progrnumber,actual_stop_id,stop_lat,stop_lon,stop_id,stop_name
1,3222,53.24660248,-6.128656806,8250DB003222,"Loughlinstown, Loughlinstown Wood Estate"
2,3223,53.24915041,-6.132936556000001,8250DB003223,"Druid Valley, F.A.S Training Centre"
3,3224,53.25194585,-6.132365196,8250DB003224,"Ballybrack, Ashlawn Park"
4,3225,53.25529487,-6.13385301,8250DB003225,"Druid Valley, Churchview Rd,  Willow Vale"
5,3226,53.25854707,-6.137773557999999,8250DB003226,"Ballybrack, Churchview Road (Granville Rd)"
6,3227,53.26195417,-6.137805394,8250DB003227,"Sallynoggin, Churchview Road"
7,3228,53.26475425,-6.134655395,8250DB003228,"Killiney, Churchview Road"
8,3229,53.26535278,-6.134419453,8250DB003229,"Killiney, Church Road"
9,7472,53.26706808,-6.136623621,8250DB007472,Rochestown Avenue Opposite Killiney Shop
10,3230,53.26850153,-6.139200038999999,8250DB003230,"Sallynoggin, Drumkeen Manor"
11,3232,53.27160397,-6.140444733,8250DB003232,"Sallynoggin, Pearse Villas"
12,3233,53.27274148,-6.141340004,8250DB003233,"Sallynoggin, Pearse Street (Pearse Villas)"
13,3234,53.27360361,-6.139563206,8250DB003234,"Glenageary Heights, Sallynoggin College"
14,4462,53.27516727,-6.137815817999999,8250DB004462,"Sallynoggin, Pearse Street (Park Close)"
15,3235,53.27718071,-6.1406974860000005,8250DB003235,"Sallynoggin, Saint Kevin's School Pearse Saint"
16,3236,53.2779835,-6.140302725,8250DB003236,"Sallynoggin, Sallynoggin Road (O'Donnell Gardens)"
17,3237,53.27914236,-6.137957911,8250DB003237,"Glenageary, Sallynoggin Road"
18,3238,53.28330973,-6.133727199,8250DB003238,"Glenageary, Holmstown Avenue"
19,3239,53.2843865,-6.133035331,8250DB003239,"Glenageary, Lower Glenageary Rd (Crosthwaite Park Sth)"
20,3240,53.28717187,-6.131248929,8250DB003240,Lower Glenageary Road (Corrig Road)
21,3068,53.28982949,-6.1304879020000005,8250DB003068,"Dun Laoghaire, Upper George's Street"
22,3069,53.29075303,-6.132637683,8250DB003069,"Dun Laoghaire, Upper George's Street"
23,3070,53.292115100000004,-6.135818533999999,8250DB003070,"Dun Laoghaire, Dun Laoghaire Shopping Centre"
24,2041,53.29359761,-6.139234377,8250DB002041,"Dun Laoghaire, Bloomfield Shopping Centre"
25,3071,53.29498472,-6.145189969,8250DB003071,"Dun Laoghaire, Dunleary Hill"
26,3072,53.29418522,-6.148690061,8250DB003072,"Dun Laoghaire, Longford Place"
27,3073,53.29378259,-6.155188246,8250DB003073,Monkstown
28,3074,53.29449303,-6.159283182,8250DB003074,"Monkstown, Monkstown Road"
29,3075,53.29488038,-6.162251951,8250DB003075,"Monkstown, Monkstown Road (Queen's Park)"
30,3076,53.29543281,-6.166023823,8250DB003076,"Monkstown, Monkstown Road (Montpelier Parade)"
31,3077,53.29591972,-6.1684633689999995,8250DB003077,"Blackrock (DunLaoghaire-Rathdown), Monkstown Road"
33,3079,53.29830741,-6.170596685,8250DB003079,"Blackrock (DunLaoghaire-Rathdown), Seapoint Avenue"
34,3080,53.30023113,-6.174130412999999,8250DB003080,"Blackrock (Dun), Church"
35,3081,53.30061046,-6.177775233999999,8250DB003081,"Blackrock (DunLaoghaire-Rathdown), Frascati Road"
36,3084,53.30138125,-6.181163412,8250DB003084,"Blackrock (DunLaoghaire-Rathdown), Frascati Shopping Centre"
37,469,53.30284573,-6.184072133,8250DB000469,"Blackrock (Dun), Rock Road"
38,470,53.30562585,-6.188981104,8250DB000470,"Booterstown, Blackrock Clinic"
39,471,53.30687081,-6.191059299,8250DB000471,"Booterstown, Blackrock College"
40,472,53.30788203,-6.194918267,8250DB000472,"Booterstown, Rock Road (Booterstown Avenue)"
41,473,53.30924058,-6.197382139,8250DB000473,"Blackrock (DunLaoghaire-Rathdown), Rock Road (Grotto Avenue)"
42,4705,53.31081827,-6.200077066,8250DB004705,"Booterstown, Rock Road (Saint Helen's Road)"
43,475,53.31270616,-6.201888675,8250DB000475,"Booterstown, Rock Road (Bellevue Avenue)"
44,476,53.31575153,-6.204762522999999,8220DB000476,"Merrion, Merrion Gates"
45,477,53.31686305,-6.20695232,8220DB000477,"Merrion, Merrion Road (Estate Ave)"
46,478,53.31811429999999,-6.211267825,8220DB000478,"Merrion, Saint Vincent's Hospital"
47,479,53.31914397,-6.213401287000001,8220DB000479,"Merrion, Merrion Shopping Centre"
48,480,53.32084998,-6.216287205,8220DB000480,"Merrion, Merrion Road (Ailesbury Road)"
49,481,53.32234464,-6.218266442999999,8220DB000481,"Ballsbridge, Merlyn Road"
50,482,53.32472778,-6.221965295,8220DB000482,"Ballsbridge, Merrion Road"
51,483,53.32599756,-6.2239392339999995,8220DB000483,"Ballsbridge, Merrion Road"
52,485,53.328352100000004,-6.228750913,8220DB000485,"Ballsbridge, Merrion Road RDS"
53,487,53.33085529,-6.233902307999999,8220DB000487,"Ballsbridge, American Embassy"
54,488,53.33309855,-6.236076947000001,8220DB000488,"Dublin City South, Lansdowne Park"
55,489,53.334942000000005,-6.237352313,8220DB000489,"Dublin City South, Northumberland Road"
56,490,53.33662663,-6.238829547999999,8220DB000490,"Beggar'S Bush, Northumberland Road"
57,491,53.33781405,-6.2413335110000006,8220DB000491,"Dublin City South, Lower Mount Street"
58,492,53.33858469,-6.243614462000001,8220DB000492,"Pembroke West, Lower Mount Street"
59,493,53.33985342,-6.247376823,8220DB000493,"Merrion Square, Holles Street"
60,494,53.34133589,-6.251626258,8220DB000494,Clare Street
61,495,53.34359132,-6.249746705,8220DB000495,"Pearse Station, Outside Train Station"
62,400,53.34475116,-6.252838258,8220DB000400,"Trinity College, Shaw Street"
63,281,53.35090995,-6.260968421,8220DB000281,"Rotunda, Dublin Bus Head Office"
64,4,53.35257451,-6.264175486,8220DB000004,"Rotunda, Rotunda Hospital"
